"Product Details","ASIN","URL","Image URL","Brand","Price $","Sales","Revenue","BSR","Seller Country/Region","Fees $","Active Sellers #","Ratings","Review Count","Images","Review velocity","Buy Box","Category","Size Tier","Fulfillment","Dimensions","Weight","Creation Date"
"($) Lifetime Home Lift Top Coffee Table with Hidden Compartment and Storage Shelf - Living Room Dining Table with Rising Tabletop Lifttop Desk for Apartment, Home, Condo - Rustic Brown","B0C4RML34X","https://www.amazon.com/dp/B0C4RML34X?psc=1","https://m.media-amazon.com/images/I/71mEGx2BjaL._AC_SY450_.jpg","Lifetime Home",63.95,"n/a","n/a","160,777","US",47.46,2,"n/a",0,8,0,"Lifetime Appliance Parts","Home & Kitchen","Small Oversize","MFN","25.0x25.0x15.0",48.00,"5/9/2023"
"Furinno Modern Simplistic Criss-Crossed Coffee Table, 35.4 in x 19.6 in x 16 in, French Oak Grey","B08XX3V5DD","https://www.amazon.com/dp/B08XX3V5DD?psc=1","https://m.media-amazon.com/images/I/51mzdHOFD8L._AC_SY450_.jpg","Furinno",26.32,"1,312","34,531.84","9,235","AMZ",22.08,10,3.4,"2,364",6,54,"Amazon","Home & Kitchen","Small Oversize","FBA","22.1x2.0x37.9",20.55,"3/3/2021"
"Yaheetech Lift Top Coffee Table with Hidden Compartment and Storage Shelf, Rising Tabletop Dining Table for Living Room Reception Room, 38.6in L, Rustic Brown","B07ZFNN72Z","https://www.amazon.com/dp/B07ZFNN72Z?psc=1","https://m.media-amazon.com/images/I/61HsodbliBL._AC_SX679_.jpg","Yaheetech",69.99,"5,509","385,574.91","6,606","US",39.54,2,4.5,"13,806",9,211,"Yaheetech","Home & Kitchen","Small Oversize","MFN","22.8x3.9x44.1",46.53,"10/22/2019"
"Furinno Simple Design Coffee Table, Espresso","B003VOZE6M","https://www.amazon.com/dp/B003VOZE6M?psc=1","https://m.media-amazon.com/images/I/51FwiT03ZOL._AC_SX466_.jpg","Furinno",29.44,"2,069","60,911.36","11,315","AMZ",17.71,9,4.1,"14,425",7,190,"Amazon","Home & Kitchen","Small Oversize","AMZ","24.0x2.8x38.5",19.35,"8/19/2011"
"Furinno JAYA Simple Design Oval Coffee Table, Walnut","B01FX5CMKC","https://www.amazon.com/dp/B01FX5CMKC?psc=1","https://m.media-amazon.com/images/I/61MqCAi-l7L._AC_SX569_.jpg","Furinno",33.80,"n/a","n/a","75,786","AMZ",25.72,14,3.7,"2,884",6,"1,107","Amazon","Home & Kitchen","Small Oversize","AMZ","21.7x2.9x38.2",26.24,"5/19/2016"
"SAYGOER Coffee Table Small Square Modern Coffee Tables for Small Spaces Simple Farmhouse Low Center Table for Living Room Home Office, Rustic Wooden Top with Metal Frames, Easy Assembly, Grey Wooden","B09HBQFVFJ","https://www.amazon.com/dp/B09HBQFVFJ?psc=1","https://m.media-amazon.com/images/I/91YAxBJFkXL._AC_SX569_.jpg","SAYGOER",79.95,347,"27,742.65","91,081","CN",30.12,1,4.6,636,7,9,"SAYGOER DIRECT","Home & Kitchen","Small Oversize","FBA","28.0x3.0x31.0",20.55,"9/28/2021"
"FDW Lift Top Coffee Table with Hidden Compartment and Storage Shelf Wooden Lift Tabletop for Home Living Room Reception Room Office (Brown)","B08W8NJGNX","https://www.amazon.com/dp/B08W8NJGNX?psc=1","https://m.media-amazon.com/images/I/71QOZKHT7WL._AC_SY355_.jpg","FDW",40.99,"2,303","94,399.97","15,424","US",39.82,1,4.2,"1,522",7,106,"Cavalier Store","Home & Kitchen","Small Oversize","MFN","24.0x43.0x5.0",58.00,"2/9/2021"
"Ameriwood Home Parsons Modern Coffee Table, Black","B005QLJL3K","https://www.amazon.com/dp/B005QLJL3K?psc=1","https://m.media-amazon.com/images/I/81UdbeScHLL._AC_SX425_.jpg","DHP",42.84,775,"33,201.00","30,022","AMZ",22.04,1,4.3,"5,209",8,23,"Amazon","Home & Kitchen","Small Oversize","AMZ","19.8x2.0x47.0",14.94,"9/28/2011"
"ChooChoo Mission Coffee Table, Black Wood Living Room Table with Shelf, 40 Black","B07T24P7MP","https://www.amazon.com/dp/B07T24P7MP?psc=1","https://m.media-amazon.com/images/I/71eymqAE8sL._AC_SX466_.jpg","ChooChoo",109.99,737,"81,062.63","37,566","CN",28.68,1,4.4,"1,140",6,32,"ChooChoo Furniture","Home & Kitchen","Small Oversize","FBA","25.1x5.0x44.0",41.76,"6/12/2019"
"ChooChoo Oxford Coffee Table with Thicker Legs, Black Wood Coffee Table with Storage for Living Room","B07T238M73","https://www.amazon.com/dp/B07T238M73?psc=1","https://m.media-amazon.com/images/I/71rIs5b2PfS._AC_SX466_.jpg","ChooChoo",109.99,537,"59,064.63","54,432","CN",43.45,7,4.4,"1,094",7,30,"ChooChoo Furniture","Home & Kitchen","Small Oversize","FBA","24.0x5.0x43.5",42.51,"6/12/2019"
"NOBLEWELL Coffee Table Lift Top with Storage Compartment and Separated Open Shelves, Pop Up Coffee Table for Living Room, 39.4in L, Vintage Brown","B0922FNFBK","https://www.amazon.com/dp/B0922FNFBK?psc=1","https://m.media-amazon.com/images/I/715ZWgqT1hL._AC_SX569_.jpg","NOBLEWELL",109.99,359,"39,486.41","33,147","CN",46.39,12,4.3,"1,041",8,28,"NOBLEWELL Direct","Home & Kitchen","Small Oversize","FBA","23.1x5.0x42.1",48.11,"7/1/2021"
"WLIVE Lift Top Coffee Table with Storage for Living Room,Small Hidden Compartment and Adjustable Shelf,Mid Century, Modern ,Wood,Grey","B09X17XQXL","https://www.amazon.com/dp/B09X17XQXL?psc=1","https://m.media-amazon.com/images/I/71sNZGBBMML._AC_SX425_.jpg","WLIVE",99.99,"4,833","483,251.67","5,249","CN",39.43,3,4.3,"5,087",7,145,"WLIVE","Home & Kitchen","Small Oversize","FBA","21.7x4.3x43.1",47.11,"6/17/2021"
"Living Room Rectangle Coffee Table, Tea Table Suitable for Waiting Room, Modern Side Coffee Table with Wooden Leg, Glass Tabletop with Lower Shelf, White","B09JZ2QJSJ","https://www.amazon.com/dp/B09JZ2QJSJ?psc=1","https://m.media-amazon.com/images/I/71ielDQgBaL._AC_SY355_.jpg","Btrpily",112.99,269,"30,394.31","91,050","CN",44.74,1,4.7,132,6,5,"YOUCHOOSE DIRECT","Home & Kitchen","Small Oversize","FBA","23.5x6.3x41.5",39.31,"10/21/2021"
"aboxoo Coffee Table Nesting White Set of 2 Side Set Golden Frame Circular and Marble Pattern Wooden Tables, Living Room Bedroom Apartment Modern Industrial Simple Nightstand","B09G2ZQFHP","https://www.amazon.com/dp/B09G2ZQFHP?psc=1","https://m.media-amazon.com/images/I/71k8NdCLtlL._AC_SY450_.jpg","aboxoo",74.99,"1,058","79,339.42","36,313","CN",27.70,4,4.3,"1,150",9,56,"callalily","Home & Kitchen","Small Oversize","FBA","25.8x3.5x25.8",15.20,"9/13/2021"
"AWQM GJ08 Marble Coffee Table, 39.3 in, White and Black","B0932TS5H5","https://www.amazon.com/dp/B0932TS5H5?psc=1","https://m.media-amazon.com/images/I/81TlzOCs+9L._AC_SX569_.jpg","AWQM",84.00,484,"40,656.00","79,475","AMZ",33.25,7,4.3,525,7,24,"Amazon","Home & Kitchen","Small Oversize","FBA","23.3x2.8x42.3",26.40,"4/21/2021"
"Best Choice Products Wooden Mid-Century Modern Coffee Table, Accent Furniture for Living Room, Indoor, Home Décor w/Open Storage Shelf, Wood Grain Finish - White/Brown","B08LHN8CL1","https://www.amazon.com/dp/B08LHN8CL1?psc=1","https://m.media-amazon.com/images/I/71OSGBbTjvL._AC_SX569_.jpg","Best Choice Products",69.99,912,"63,830.88","47,564","US",33.25,1,4.4,"3,092",7,32,"BestChoiceproducts","Home & Kitchen","Small Oversize","MFN","22.4x46.4x3.5",31.70,"8/19/2020"
"($) WLIVE Wood Lift Top Coffee Table with Hidden Compartment and Adjustable Storage Shelf, Lift Tabletop Dining Table for Home Living Room, Office, Rustic Oak","B084ZH1LYN","https://www.amazon.com/dp/B084ZH1LYN?psc=1","https://m.media-amazon.com/images/I/81xhCy8yQ6L._AC_SX466_.jpg","WLIVE",99.99,"4,833","483,251.67","5,249","CN",43.63,5,4.3,"5,087",9,146,"WLIVE","Home & Kitchen","Small Oversize","FBA","21.8x4.5x42.5",45.11,"5/29/2020"
"($) HOMREST 39.4 Inch Wooden Lift Top Coffee Table with Storage Shelf and Hidden Compartment, Rising Coffee Tabletop Computer Table for Reception Room and Living Room, Brown","B0BLHCX4H8","https://www.amazon.com/dp/B0BLHCX4H8?psc=1","https://m.media-amazon.com/images/I/919fgkEF-pL._AC_SY355_.jpg","HOMREST",84.99,56,"4,759.44","683,058","CN","n/a",1,5.0,5,8,0,"HOMREST","Home & Kitchen","n/a","MFN","n/a","n/a","11/3/2022"
"($) WLIVE Lift Top Coffee Table for Living Room,Coffee Table with Storage,Hidden Compartment and Metal Frame, Central Table for Reception Room,Espresso","B0BBQ2XMCH","https://www.amazon.com/dp/B0BBQ2XMCH?psc=1","https://m.media-amazon.com/images/I/711JULsbk6L._AC_SY355_.jpg","WLIVE",109.99,276,"30,357.24","92,861","CN",43.87,1,3.8,122,8,19,"WLIVE","Home & Kitchen","Small Oversize","FBA","21.7x5.0x42.5",42.61,"8/24/2022"
"($) KSWIN Industrial End Table Side Table with 2-Tier Storage Shelf, 18'' Square Nightstand Bedside Table X-Design Metal Frame for Living Room Bedroom, Rustic Brown","B08S49Y41X","https://www.amazon.com/dp/B08S49Y41X?psc=1","https://m.media-amazon.com/images/I/716RF85B2aL._AC_SY450_.jpg","KSWIN",64.98,277,"17,999.46","114,564","CN",27.04,1,4.7,394,7,6,"KSWIN","Home & Kitchen","Small Oversize","FBA","20.3x3.8x22.4",18.54,"1/5/2021"
"Sweetcrispy Coffee Table, Lift Top Coffee Tables for Living Room,Rising Tabletop Wood Dining Center Tables with Storage Shelf and Hidden Compartment","B0C5X64YMX","https://www.amazon.com/dp/B0C5X64YMX?psc=1","https://m.media-amazon.com/images/I/71tc5bm9a3L._AC_SY450_.jpg","Sweetcrispy",69.99,245,"17,147.55","16,368","AMZ",34.51,2,4.5,73,9,0,"Amazon","Home & Kitchen","Small Oversize","AMZ","18.0x40.0x4.0",35.00,"5/22/2023"
"IKIFLY Modern High Glossy Black Coffee Table with 16 Colors LED Lights, Contemporary Rectangle Design Living Room Furniture, 2 Tiers","B0B1QF3QXT","https://www.amazon.com/dp/B0B1QF3QXT?psc=1","https://m.media-amazon.com/images/I/819BoGI9lBL._AC_SX466_.jpg","IKIFLY",199.99,374,"74,796.26","71,693","CN","n/a",1,4.0,311,9,23,"Lithome store","Home & Kitchen","n/a","MFN","n/a","n/a","5/19/2022"
"High Gloss Lift Top Table with Led Lights, Led Coffee Table with Storage Shelf and Hidden Compartment for Home Living Room Reception Room Office, White","B0BHZBB93P","https://www.amazon.com/dp/B0BHZBB93P?psc=1","https://m.media-amazon.com/images/I/81Ni72cxwkL._AC_SX466_.jpg","St.Mandyu",119.99,113,"13,558.87","176,839","CN","n/a",1,3.1,26,8,6,"Anqinmh","Home & Kitchen","n/a","MFN","n/a","n/a","10/12/2022"
"Ameriwood Home Carver Coffee Table, Gray","B01N0D7VC8","https://www.amazon.com/dp/B01N0D7VC8?psc=1","https://m.media-amazon.com/images/I/71lXEubxAbL._AC_SX466_.jpg","Ameriwood Home",87.66,"n/a","n/a","3,332","AMZ",50.18,4,4.5,"3,310",15,0,"Amazon","Our Brands","Small Oversize","AMZ","14.0x8.5x40.3",65.76,"11/14/2016"
"($) Xmatch Tempered Glass Coffee Table for Living Room Furniture with 2 Tiers Size 39.4in x 23.7in (WXD) Black","B08BRYRVKB","https://www.amazon.com/dp/B08BRYRVKB?psc=1","https://m.media-amazon.com/images/I/61r-OgA5k9L._AC_SY355_.jpg","Xmatch",85.59,24,"2,054.16","658,595","CN",41.78,1,4.6,181,8,0,"Xmatch USA","Home & Kitchen","Small Oversize","MFN","26.0x41.0x5.0",47.20,"6/24/2020"
"($) IBF Natural Wood Coffee Table, Rustic Solid Wood Center Table for Living Room, Rectangle Metal and Real Wood Tea Table, Modern Industrial Minimalist Wooden Cocktail Table, Rustic Brown, 47 Inch","B08XYQPB6N","https://www.amazon.com/dp/B08XYQPB6N?psc=1","https://m.media-amazon.com/images/I/81j3Q-Bnr5L._AC_SY450_.jpg","IBF",159.98,97,"15,518.06","268,978","US",57.25,1,4.1,21,8,1,"IBF Furniture","Home & Kitchen","Small Oversize","FBA","26.5x4.0x51.5",27.21,"3/4/2021"
"($) COZAYH 2-Piece Modern Farmhouse Living Room Coffee Table Set, Nesting Table Round Natural Finish with Handcrafted Wood Radial Pattern","B09ZQK3WXS","https://www.amazon.com/dp/B09ZQK3WXS?psc=1","https://m.media-amazon.com/images/I/81+szv7yDIL._AC_SY355_.jpg","COZAYH",209.99,533,"111,924.67","69,337","US","n/a",1,4.5,598,8,28,"Cozayh","Home & Kitchen","n/a","MFN","n/a","n/a","5/7/2022"
"($) WLIVE Lift Top Coffee Table for Living Room,Coffee Table with Storage,Hidden Compartment and Metal Frame, Central Table with 4 Casters for Reception Room,Rustic Brown.","B0BJ6WJVG2","https://www.amazon.com/dp/B0BJ6WJVG2?psc=1","https://m.media-amazon.com/images/I/81lnK7rT8UL._AC_SX466_.jpg","WLIVE",99.99,163,"16,298.37","114,787","CN",41.95,1,4.1,42,9,5,"WLIVE","Home & Kitchen","Small Oversize","FBA","22.5x4.0x45.0",44.01,"10/14/2022"
"ChooChoo Farmhouse Coffee Table, Rustic Vintage Living Room Table with Shelf, 40 White","B08SHCR143","https://www.amazon.com/dp/B08SHCR143?psc=1","https://m.media-amazon.com/images/I/8189SDyX4jS._AC_SY450_.jpg","ChooChoo",159.99,656,"104,953.44","41,445","CN",53.47,2,4.6,848,8,25,"ChooChoo Furniture","Home & Kitchen","Small Oversize","FBA","25.3x6.0x44.0",40.56,"1/8/2021"
"Depointer Life Glass Coffee Table, Rectangle Modern Side Coffee Table with Lower Shelf, Perfect for Living Room Conversation Leisure Occasions, Metal Leg, Black","B08CH9GN83","https://www.amazon.com/dp/B08CH9GN83?psc=1","https://m.media-amazon.com/images/I/81e9qp45SHL._AC_SX425_.jpg","Depointer Life",79.59,193,"15,360.87","225,643","CN",42.25,2,4.7,"1,392",7,3,"Depointer Direct","Home & Kitchen","Small Oversize","MFN","25.0x5.9x41.5",49.46,"7/7/2020"
"SUPER DEAL 2-Tier Industrial Coffee Table with Storage Shelf for Small Apartment Living Room, Rectangle Wood and Stable Metal TV Stand Side End Table, Rustic Brown","B08N4TDMF4","https://www.amazon.com/dp/B08N4TDMF4?psc=1","https://m.media-amazon.com/images/I/71CuUQLcDhL._AC_SX569_.jpg","SUPER DEAL",48.99,"1,176","57,612.24","30,687","CN",58.47,1,4.6,922,7,47,"SuperDealUsa","Home & Kitchen","Medium Oversize","MFN","16.5x20.0x31.5",25.00,"11/9/2020"
"HOOBRO End Table with Charging Station and USB Ports, 3-Tier Nightstand with Adjustable Shelf, Narrow Side Table for Small Space in Living Room, Bedroom and Balcony, Rustic Brown BF112BZ01","B09X395CNV","https://www.amazon.com/dp/B09X395CNV?psc=1","https://m.media-amazon.com/images/I/71BlC+UiJ8L._AC_SY355_.jpg","HOOBRO",39.99,"2,157","86,258.43","9,518","CN",15.41,4,4.4,365,9,62,"Hoobro","Home & Kitchen","Large Standard-Size","FBA","12.3x4.1x17.1",9.66,"4/2/2022"
"($) JOMEED 3 in 1 Lift Top Coffee Table, Large Coffee Table with Storage for Living Room, Marble Pattern Modern Lift Tabletop Dining Table with Hidden Storage Compartment and Open Storage Shelf","B0BMQJ3W86","https://www.amazon.com/dp/B0BMQJ3W86?psc=1","https://m.media-amazon.com/images/I/81eDagiu59L._AC_SX679_.jpg","JOMEED",194.99,30,"5,849.70","659,875","CN","n/a",1,4.2,14,9,1,"JOMEED","Home & Kitchen","n/a","MFN","n/a","n/a","11/17/2022"
"($) Wood Coffee Table for Living Room Sliding Top with Hidden Storage,Rectangle Modern Cocktail Table, Pull Out Center Table, Extendable Contemporary, for Home Office Reception Room White Natural Wood","B0BWN6S71L","https://www.amazon.com/dp/B0BWN6S71L?psc=1","https://m.media-amazon.com/images/I/91V+4tkC-vL._AC_SY450_.jpg","HedoAjim",157.92,12,"1,895.04","1,114,809","CN",62.40,1,3.7,3,9,0,"LivStorm","Home & Kitchen","Small Oversize","MFN","27.0x44.0x5.9",69.68,"2/23/2023"
"($) Coffee Table for Living Room, 47''Modern Faux Marble Top Coffee Table with Metal Frame, 2-Tier Living Room Table with Storage Shelf, Rectangular Center Table for Living Room, Office, Black","B0BP21H5VF","https://www.amazon.com/dp/B0BP21H5VF?psc=1","https://m.media-amazon.com/images/I/918JgB6r0AL._AC_SX425_.jpg","gatherstar",129.99,21,"2,729.79","572,342","CN","n/a",2,5.0,2,6,0,"Nice Furniture for You","Home & Kitchen","n/a","MFN","n/a","n/a","12/5/2022"
"Rectangle Modern Coffee Table, Tempered Glass Top and Metal Tubular Leg, 47.3”Lx23.6”Wx18.1”H, Silver","B0BLV6PK3D","https://www.amazon.com/dp/B0BLV6PK3D?psc=1","https://m.media-amazon.com/images/I/91ADrZpvMNL._AC_SX522_.jpg","Edwin's Choice",158.85,512,"81,331.20","56,713","CN",54.56,1,4.4,46,6,9,"Edwin's Choice","Home & Kitchen","Small Oversize","FBA","26.0x3.5x50.0",50.61,"11/9/2022"
"Best Choice Products 2-Tier 35.5in Round Industrial Coffee Table, Rustic Steel Accent Table for Living Room, w/Wooden Tabletop, Reinforced Crossbars, Padded Feet, Open Shelf, Raised Bottom - Gray","B0B5FL6Y2N","https://www.amazon.com/dp/B0B5FL6Y2N?psc=1","https://m.media-amazon.com/images/I/81pJCYptKML._AC_SY450_.jpg","Best Choice Products",99.99,420,"41,995.80","81,924","US",56.73,1,4.7,959,7,19,"BestChoiceproducts","Home & Kitchen","Medium Oversize","MFN","37.0x37.0x5.5",32.00,"10/8/2021"
"LIDYUK End Table with Charging Station, Flip Top Side Table with USB Ports and Outlets, Nightstand for Small Spaces, Bedside Tables with Storage Shelf for Living Room, Bedroom, Dark Cherry","B0C1ZB5XCV","https://www.amazon.com/dp/B0C1ZB5XCV?psc=1","https://m.media-amazon.com/images/I/71bPE4JebFL._AC_SX569_.jpg","LIDYUK",79.99,"3,050","243,969.50","14,315","CN",23.81,1,4.5,"1,899",7,0,"LIDYUK","Home & Kitchen","Large Standard-Size","FBA","13.4x6.2x17.4",17.44,"4/10/2023"
"HOMMPA LED Coffee Tables for Living Room Modern Coffee Table with 4 Drawers High Glossy Center Table with Storage White Coffee Table Cocktail Table with 16 Colors LED Lighting White","B0B28RSC4K","https://www.amazon.com/dp/B0B28RSC4K?psc=1","https://m.media-amazon.com/images/I/71NA3hqs4yL._AC_SY450_.jpg","HOMMPA",199.98,34,"6,799.32","299,209","CN","n/a",2,3.2,118,6,0,"Phycomn","Home & Kitchen","n/a","MFN","25.2x42.9x6.9","n/a","6/15/2022"
"Small Round Coffee Table Circle Modern White Coffee Tables for Living Room Center Table for Small Spaces 24 Inch Wood Accent Coffe Tables Mesa De Centro","B0BGMW8X6M","https://www.amazon.com/dp/B0BGMW8X6M?psc=1","https://m.media-amazon.com/images/I/61LzMnCmIoL._AC_SX466_.jpg","STELOD",49.42,322,"15,913.24","107,925","CN",16.98,1,4.0,173,5,11,"STELOD","Home & Kitchen","Large Standard-Size","FBA","13.2x4.6x17.8",10.25,"n/a"
"WLIVE Round Coffee Table, Living Room Table with 2-Tier Storage Shelf,32in Wood Modern Coffee Table with Metal Frame and Wood Desktop,Easy Assembly,Charcoal Black.","B0B8N5HHG4","https://www.amazon.com/dp/B0B8N5HHG4?psc=1","https://m.media-amazon.com/images/I/815tU43E3GL._AC_SY450_.jpg","WLIVE",69.99,332,"23,236.68","71,008","CN",32.83,1,4.4,102,8,8,"WLIVE","Home & Kitchen","Small Oversize","FBA","18.2x4.0x35.0",30.96,"8/4/2022"
"Lifetime Home Lift Top Coffee Table with Hidden Compartment and Storage Shelf - Living Room Dining Table with Rising Tabletop Lifttop Desk for Apartment, Home, Condo - Rustic Brown","B0C4RML34X","https://www.amazon.com/dp/B0C4RML34X?psc=1","https://m.media-amazon.com/images/I/71mEGx2BjaL._AC_SY450_.jpg","Lifetime Home",63.95,"n/a","n/a","160,777","US",47.46,2,"n/a",0,8,0,"Lifetime Appliance Parts","Home & Kitchen","Small Oversize","MFN","25.0x25.0x15.0",48.00,"5/9/2023"
"WOHOMO Coffee Table, 2 in 1 Unique Detachable Nesting Coffee Table Set of 2, Small Round and Rectangular Living Room Table Set, Industrial Modern Style Coffee Tables for Living Room, Rustic Brown","B0999LY3D4","https://www.amazon.com/dp/B0999LY3D4?psc=1","https://m.media-amazon.com/images/I/81rytBRS9GL._AC_SX679_.jpg","WOHOMO",105.99,370,"39,216.30","84,169","CN",40.75,3,4.5,743,7,39,"Wohomo","Home & Kitchen","Small Oversize","FBA","25.0x3.8x35.8",36.31,"7/13/2021"
"VASAGLE Small Coffee Table Set of 2, Round Coffee Table with Steel Frame, Side End Table for Living Room, Bedroom, Office, Rustic Brown and Black","B08JSXNVKR","https://www.amazon.com/dp/B08JSXNVKR?psc=1","https://m.media-amazon.com/images/I/715b4VhLIpL._AC_SX679_.jpg","VASAGLE",69.88,"1,034","72,255.92","33,731","n/a",31.78,14,4.6,"1,687",9,46,"n/a","Home & Kitchen","Small Oversize","FBA","21.7x5.2x22.9",17.82,"4/6/2021"
"Tajsoon Console Table, Industrial entryway Table, Narrow Sofa Table with Shelves,Entrance Table for Entryway, Hallway, Living Room, Foyer, Corridor, Office, Rustic Brown and Black","B0989DQJ9L","https://www.amazon.com/dp/B0989DQJ9L?psc=1","https://m.media-amazon.com/images/I/814rUarzH8L._AC_SY450_.jpg","Tajsoon",59.99,"2,608","156,453.92","14,121","CN",19.85,1,4.5,"1,195",7,77,"tajsoon","Home & Kitchen","Large Standard-Size","FBA","12.4x4.0x16.8",14.22,"6/30/2021"
"Yoobure C Shaped End Table Set of 2, Side Table for Couch and Bed, Small Side Table for Small Spaces, Living Room, Bedroom, Rustic Snack Table","B0BZHHFTL4","https://www.amazon.com/dp/B0BZHHFTL4?psc=1","https://m.media-amazon.com/images/I/61P3S0qnKFL._AC_SX466_.jpg","Yoobure",45.04,761,"34,275.44","26,076","HK",22.79,1,4.6,313,6,8,"Super A Plus","Home & Kitchen","Small Oversize","FBA","17.5x5.1x17.9",15.44,"5/20/2023"
"IANIYA Glass Coffee Table Black Metal Tube Clear Glass Coffee Table (All-Black)","B0BVDQ477G","https://www.amazon.com/dp/B0BVDQ477G?psc=1","https://m.media-amazon.com/images/I/71v8s179kbL._AC_SX569_.jpg","IANIYA",119.99,521,"62,514.79","50,769","CN",48.73,2,4.6,"1,931",9,22,"IANIYA FURNITURE","Home & Kitchen","Small Oversize","FBA","26.5x5.0x42.3",50.11,"6/17/2021"
"Yoobure C Shaped End Table with Charging Station, Small Side Tables for Living Room, Bedroom, Sofa Table with USB Ports and Outlets for Small Spaces, C Couch Table Rustic Snack Table Bed Side Table","B0BD587DGS","https://www.amazon.com/dp/B0BD587DGS?psc=1","https://m.media-amazon.com/images/I/71LZk45zymL._AC_SX466_.jpg","Yoobure",47.99,"2,602","124,869.98","10,477","CN",16.61,1,4.6,693,7,103,"Yoobure Direct","Home & Kitchen","Large Standard-Size","FBA","11.6x4.0x17.7",9.79,"11/21/2022"
"Yaheetech Console Table with Drawer, Narrow Entryway Table for Living Room with Storage Shelves, Industrial Wood Hallway Sofa Table with Metal Frame, Gray","B097RPHWFH","https://www.amazon.com/dp/B097RPHWFH?psc=1","https://m.media-amazon.com/images/I/81J-SLmfTLS._AC_SX569_.jpg","Yaheetech",88.99,"1,001","89,078.99","34,244","US",43.24,1,4.6,"2,541",9,70,"Yaheetech","Home & Kitchen","Small Oversize","MFN","15.0x6.7x44.1",48.29,"6/24/2021"
"Rectangle Glass Coffee Table-Black Modern Side Coffee Table with Lower Shelf Wooden Legs Suit for Living Room, Dining Room, Office Glass Coffee Table with Storage Shelf for Coffee Tea Books Magazine","B0B7MNG9RZ","https://www.amazon.com/dp/B0B7MNG9RZ?psc=1","https://m.media-amazon.com/images/I/712A1F7StRL._AC_SX466_.jpg","HUBSE",69.99,242,"16,937.58","120,050","US","n/a",1,4.1,256,7,9,"HUBESTSELLER","Home & Kitchen","n/a","MFN","n/a","n/a","7/26/2022"
"Bestier LED Coffee Tables for Living Room, 42 Inch Wood Center Table with Glass Top for Game Night. Living Room Tables Rustic Brown","B09R94QL35","https://www.amazon.com/dp/B09R94QL35?psc=1","https://m.media-amazon.com/images/I/81aGh6tkOPL._AC_SX425_.jpg","Bestier",189.99,266,"50,537.34","165,218","US",57.66,2,4.4,164,9,17,"Bestier Direct","Home & Kitchen","Small Oversize","FBA","24.3x4.3x46.5",47.11,"1/27/2022"
"SAYGOER Glass Coffee Table, Small Modern Coffee Table Square Simple Center Tables for Living Room 26.7 x 26.7 x 15.7 Inches, Gray Black","B094NTR166","https://www.amazon.com/dp/B094NTR166?psc=1","https://m.media-amazon.com/images/I/91cTZVQORnL._AC_SX425_.jpg","SAYGOER",79.88,558,"44,573.04","46,039","CN",32.21,7,4.7,696,9,29,"SAYGOER DIRECT","Home & Kitchen","Small Oversize","FBA","29.2x2.5x34.7",25.85,"5/11/2021"
"Cozy Castle Modern Coffee Table, Wooden Console Table 2 Tier with Open Storage Shelf and 1 Drawer, Easy Assembly Minimalist Hallway Table, Mid Century Modern Coffee Table for Living Room Home Office","B0972W75N8","https://www.amazon.com/dp/B0972W75N8?psc=1","https://m.media-amazon.com/images/I/91enu-GRGqS._AC_SX569_.jpg","Cozy Castle",89.99,166,"14,938.34","156,319","CN","n/a",1,4.4,147,8,9,"cozypshouse","Home & Kitchen","n/a","MFN","4.7x23.0x44.5","n/a","6/11/2021"
"Furinno Simplistic Set of 2 End Table, French Oak Grey/Grey","B00OR1KO22","https://www.amazon.com/dp/B00OR1KO22?psc=1","https://m.media-amazon.com/images/I/51FAiTCFaHL._AC_SX466_.jpg","Furinno",26.41,"7,889","208,348.49","1,209","AMZ",20.14,8,4.3,"40,235",7,208,"Amazon","Home & Kitchen","Small Oversize","AMZ","17.0x3.5x21.0",13.15,"10/22/2014"
"Best Choice Products 44in Modern Industrial Style Rectangular Wood Grain Top Coffee Table, Rustic Accent Furniture for Living Room w/Metal Frame, 1.25in Thick Butcher Block Tabletop - Gray","B0B4FG19JB","https://www.amazon.com/dp/B0B4FG19JB?psc=1","https://m.media-amazon.com/images/I/71VVB3gVdFL._AC_SX466_.jpg","Best Choice Products",79.99,"1,159","92,708.41","37,835","US",34.33,1,4.3,794,7,21,"BestChoiceproducts","Home & Kitchen","Small Oversize","MFN","24.4x44.5x3.9",24.25,"8/18/2021"
"St.Mandyu LED Coffee Table with Storage Drawers, Modern High Glossy Table with 20 Colors LED Lights for Living Room Bedroom, Black","B0BVFF2RV1","https://www.amazon.com/dp/B0BVFF2RV1?psc=1","https://m.media-amazon.com/images/I/81Wt+x8ZVWL._AC_SX522_.jpg","St.Mandyu",109.99,129,"14,188.71","226,698","CN","n/a",1,3.7,13,6,0,"Anqinmh","Home & Kitchen","n/a","MFN","n/a","n/a","2/10/2023"
"WLIVE Coffee Table for Living Room,Wood Coffee Table with Storage,Mid-Century Modern Coffee Table with Drawer,Home,Rustic Brown.","B09X16LKSX","https://www.amazon.com/dp/B09X16LKSX?psc=1","https://m.media-amazon.com/images/I/71Sa7a1ojqL._AC_SY450_.jpg","WLIVE",69.99,385,"26,946.15","153,964","CN",32.83,1,4.1,171,7,26,"WLIVE","Home & Kitchen","Small Oversize","FBA","23.0x3.0x42.0",31.00,"4/1/2022"
"Frenchi Home Furnishing Finish End Table/Side Table","B01BOVNXGQ","https://www.amazon.com/dp/B01BOVNXGQ?psc=1","https://m.media-amazon.com/images/I/71IjCdDMoeL._AC_SY550_.jpg","Frenchi Furniture",61.20,74,"4,528.80","271,055","AMZ",29.00,1,4.6,466,6,0,"Amazon","Home & Kitchen","Small Oversize","AMZ","15.6x10.2x21.1",15.65,"n/a"
"FURINNO Simple Design End Table, 2-Pack, French Oak Grey/Black","B01D30R1RS","https://www.amazon.com/dp/B01D30R1RS?psc=1","https://m.media-amazon.com/images/I/71mLU1LgyhL._AC_SX466_.jpg","Furinno",32.01,"1,890","60,498.90","4,026","AMZ",24.19,21,4.4,"10,488",8,65,"Amazon","Home & Kitchen","Small Oversize","FBA","22.4x3.7x23.0",23.10,"3/7/2016"
"Aheaplus Lift Top Coffee Table with Storage, Wood Lifting Top Central Table Metal Frame, 43.3"" Lift Tabletop Tea Table with Side Pouch, Cocktail Table Modern Pop up Adjustable Table for Living Room","B09MYG8JHK","https://www.amazon.com/dp/B09MYG8JHK?psc=1","https://m.media-amazon.com/images/I/71UKU6HYiUL._AC_SY450_.jpg","Aheaplus",139.99,561,"78,534.39","44,025","CN",47.95,15,4.2,681,7,26,"Aheaplus","Home & Kitchen","Small Oversize","FBA","23.0x4.0x46.5",41.45,"11/12/2021"
