"Product Details","ASIN","URL","Image URL","Brand","Price $","Sales","Revenue","BSR","Seller Country/Region","Fees $","Active Sellers #","Ratings","Review Count","Images","Review velocity","Buy Box","Category","Size Tier","Fulfillment","Dimensions","Weight","Creation Date"
"($) Gewudraw Console Table with Power Outlets, 55.11"" Narrow Sofa Table with Charging Station & USB Ports, Entryway Table Behind Couch, Industrial Sofa Table for Hallway, Living Room, Bedroom","B0C272K4KX","https://www.amazon.com/dp/B0C272K4KX?psc=1","https://m.media-amazon.com/images/I/71501fqd9JL._AC_SX466_.jpg","Gewudraw",64.99,"n/a","n/a","70,513","CN",20.92,1,4.3,13,9,3,"Gewudraw","Home & Kitchen","Large Standard-Size","FBA","8.9x5.4x17.0",15.37,"5/12/2023"
"ALLOSWELL Console Table with Power Outlet, 63"" Narrow Sofa Table, Industrial Entryway Table with USB Ports, Behind Couch Table for Entryway, Hallway, Foyer, Living Room, Bedroom CTHR16E01","B09XMKSNST","https://www.amazon.com/dp/B09XMKSNST?psc=1","https://m.media-amazon.com/images/I/61oYUWe-3xL._AC_SX522_.jpg","ALLOSWELL",59.99,491,"29,455.09","80,192","CN",26.71,2,4.6,359,8,29,"ALLOSWELL","Home & Kitchen","Small Oversize","FBA","10.0x4.8x36.5",19.95,"5/1/2022"
"VASAGLE C-Shaped End Table, Small Side Table for Couch, Sofa Table with Metal Frame for Living Room, Bedroom, Bedside, Rustic Brown and Black","B08VDQN8H5","https://www.amazon.com/dp/B08VDQN8H5?psc=1","https://m.media-amazon.com/images/I/51r6RyMQCLL._AC_SX679_.jpg","VASAGLE",39.99,"2,913","116,490.87","6,224","US",16.23,3,4.7,"2,189",8,95,"Songmics Direct","Home & Kitchen","Large Standard-Size","FBA","13.0x3.1x17.2",9.08,"6/23/2021"
"Tajsoon Console Table, Industrial entryway Table, Narrow Sofa Table with Shelves,Entrance Table for Entryway, Hallway, Living Room, Foyer, Corridor, Office, Rustic Brown and Black","B0989DQJ9L","https://www.amazon.com/dp/B0989DQJ9L?psc=1","https://m.media-amazon.com/images/I/814rUarzH8L._AC_SY450_.jpg","Tajsoon",59.99,"2,608","156,453.92","14,121","CN",19.85,1,4.5,"1,195",7,77,"tajsoon","Home & Kitchen","Large Standard-Size","FBA","12.4x4.0x16.8",14.22,"6/30/2021"
"Convenience Concepts Oxford 1 Drawer Console Table with Shelves, Black","B074SWDBSX","https://www.amazon.com/dp/B074SWDBSX?psc=1","https://m.media-amazon.com/images/I/71ovWHgEu7L._AC_SX679_.jpg","Convenience Concepts",93.33,"1,410","131,595.30","22,029","AMZ",41.37,20,4.5,"9,323",10,66,"Amazon","Home & Kitchen","Small Oversize","AMZ","14.3x7.0x42.5",42.91,"8/14/2017"
"AMHANCIBLE C Shaped End Table Set of 2, Side Tables for Sofa, Couch Table Snack Side Table for Living Room Bedroom, Metal Frame, Acent, Rustic Brown HET02CBR","B09FXZTLX2","https://www.amazon.com/dp/B09FXZTLX2?psc=1","https://m.media-amazon.com/images/I/61dcs4Q+m0L._AC_SY355_.jpg","AMHANCIBLE",55.99,"1,459","81,689.41","11,501","CN",19.09,6,4.5,752,7,33,"Amhancible","Home & Kitchen","Large Standard-Size","FBA","12.9x6.5x16.7",13.93,"12/6/2021"
"SUPERJARE 70 Inch Console Table, Sofa Tables Narrow Long, Behind Couch Table Skinny, Hallway Table for Entryway, Entrance Tables for Front Door, Living Room - Vintage Brown","B0BMDNBYTW","https://www.amazon.com/dp/B0BMDNBYTW?psc=1","https://m.media-amazon.com/images/I/61i4KTdClBL._AC_SX355_.jpg","SUPERJARE",49.99,431,"21,545.69","61,259","US",26.20,1,4.4,55,7,-176,"Superjare Direct","Home & Kitchen","Small Oversize","FBA","10.8x3.8x39.0",19.30,"2/19/2023"
"MAHANCRIS 55"" Sofa Table, Industrial Console Table, 3-Tier Narrow Side Table with Open Shelves, Foyer Table for Entryway, Hallway, Kitchen, Living Room and Bedroom, Rustic Brown CTHR80401","B0BKFH339Q","https://www.amazon.com/dp/B0BKFH339Q?psc=1","https://m.media-amazon.com/images/I/71PfjddNqvL._AC_SX522_.jpg","MAHANCRIS",99.99,179,"17,898.21","186,980","CN",41.53,1,5.0,3,9,0,"ALLOSWELL","Home & Kitchen","Small Oversize","FBA","11.8x6.8x34.0",40.16,"3/30/2023"
"Walker Edison Sedalia Modern Farmhouse Metal X Entry Table, 46 Inch, Grey","B07H36DX4P","https://www.amazon.com/dp/B07H36DX4P?psc=1","https://m.media-amazon.com/images/I/612-YZ+KD2L._AC_SX679_.jpg","Walker Edison",110.82,"1,144","126,778.08","26,659","AMZ","n/a",3,4.6,"8,117",6,30,"Amazon","Home & Kitchen","Small Oversize","AMZ","15.0x5.4x50.2",40.81,"n/a"
"Ahvqevn Console Table, 51"" Entryway Table with Storage Shelves Narrow Long Sofa Table TV Console Table for Living Room Entryway, Industric Brown","B09P4VTN1R","https://www.amazon.com/dp/B09P4VTN1R?psc=1","https://m.media-amazon.com/images/I/71KB8W9JYRL._AC_SX425_.jpg","Ahvqevn",99.99,48,"4,799.52","222,194","CN",43.78,1,4.9,22,7,2,"Ahvqevn","Home & Kitchen","Small Oversize","MFN","16.0x6.0x54.5",43.06,"6/5/2022"
"($) OKD Entryway Table w/Sliding Barn Doors, 46'' Farmhouse & Industrial Console Table with Storage, Rustic Sofa Table w/Adjustable Shelf & Open Shelf for Entry Way, Hallway, Living Room, Antique White","B0BS9ZB4ZJ","https://www.amazon.com/dp/B0BS9ZB4ZJ?psc=1","https://m.media-amazon.com/images/I/81ZzLyMsWxL._AC_SY450_.jpg","OKD",199.99,432,"86,395.68","54,704","CN","n/a",1,4.6,115,6,21,"OKD-us","Home & Kitchen","n/a","MFN","n/a","n/a","2/11/2023"
"($) ODK 55"" Bar Table, Bar Height Pub Table, Counter Height Bar Table, Rectangular High Top Kitchen & Dining Counter Tables with Sturdy Legs & Easy-to-Clean Top & 10 Min Quick Assembly, Indoor use, White","B09R4LYG2K","https://www.amazon.com/dp/B09R4LYG2K?psc=1","https://m.media-amazon.com/images/I/61uRHsU7umL._AC_SX569_.jpg","ODK",119.99,573,"68,754.27","50,545","CN",41.59,7,4.6,"1,328",7,26,"Casaottima Store","Home & Kitchen","Small Oversize","FBA","19.5x4.0x59.5",32.16,"8/23/2021"
"VECELO Multipurpose Console, Narrow Sofa 2-Tier Rustic Hallway Table with Storage Shelves for Entryway/Living Room,Easy Assembly, 41.3 in x 14 in x 29.9 in (L x W x H), Brown","B07L3MSKLZ","https://www.amazon.com/dp/B07L3MSKLZ?psc=1","https://m.media-amazon.com/images/I/718kiMx0eyL._AC_SY450_.jpg","VECELO",54.99,29,"1,594.71","676,228","AMZ",29.83,3,4.6,660,7,16,"Amazon","Home & Kitchen","Small Oversize","MFN","18.0x3.5x46.0",30.10,"n/a"
"P PURLOVE Console Table for Entryway Wood Sofa Table with 3 Drawers and 1 Shelf for Hallway Living Room (Black)","B0BRM4RW3N","https://www.amazon.com/dp/B0BRM4RW3N?psc=1","https://m.media-amazon.com/images/I/91O83SiY9MS._AC_SX679_.jpg","P PURLOVE",186.99,39,"7,292.61","219,311","CN",65.92,1,4.0,2,9,-1,"Evan It","Home & Kitchen","n/a","MFN","n/a","n/a","1/10/2023"
"Furologee Console Table with 2 Drawers, Industrial Sofa Table, Entryway Table with 3-Tier Storage Shelves, Narrow Accent Table Metal Frame for Living Room/Entryway/Hallway, Rustic Brown","B097DN5MFJ","https://www.amazon.com/dp/B097DN5MFJ?psc=1","https://m.media-amazon.com/images/I/81aJDUjUc3L._AC_SX466_.jpg","Furologee",89.99,845,"76,041.55","31,380","CN",35.40,5,4.4,935,9,51,"Engriy Store","Home & Kitchen","Small Oversize","FBA","12.7x4.8x41.3",29.06,"6/17/2021"
"Convenience Concepts Oxford Console Table with Shelf, Espresso","B01CZUU8LI","https://www.amazon.com/dp/B01CZUU8LI?psc=1","https://m.media-amazon.com/images/I/71MAqF4hauL._AC_SX466_.jpg","Convenience Concepts",46.98,716,"33,637.68","19,886","AMZ",29.38,13,4.6,"8,373",8,-740,"Amazon","Home & Kitchen","Small Oversize","AMZ","15.3x6.5x42.1",29.71,"3/15/2016"
"($) LVB Industrial Console Sofa Table, Wood Metal Foyer Hallway Tables for Entryway, Wide Front Rustic Entry Way Table with Modern 3 Tier Long Open Storage Shelf for Home Living Room, Rustic Oak, 55 Inch","B09TSB53XG","https://www.amazon.com/dp/B09TSB53XG?psc=1","https://m.media-amazon.com/images/I/61sjX5CQbAL._AC_SY355_.jpg","LVB",169.97,247,"41,982.59","111,525","CN",53.86,1,4.7,158,7,13,"LVB Furniture","Home & Kitchen","Small Oversize","FBA","16.0x3.8x58.0",42.76,"3/3/2022"
"($) Ecoprsio Entryway Table with Outlets and USB Ports, Console Table with 2 Drawers, Sofa Table Narrow Long with Storage Shelves for Living Room, Couch, Hallway, Foyer, Kitchen Counter, 32'', Grey","B09P3WPWP7","https://www.amazon.com/dp/B09P3WPWP7?psc=1","https://m.media-amazon.com/images/I/715VTivNJ1L._AC_SX569_.jpg","Ecoprsio",100.18,"1,319","132,137.42","24,692","CN",37.78,3,4.6,"1,268",7,69,"Ecoprsio Store","Home & Kitchen","Small Oversize","FBA","14.9x4.9x36.5",31.45,"11/24/2021"
"($) HOSTACK Farmhouse Console Table with 2-Door Cabinet & 2 Drawers, Coffee Bar, Entryway Table with Storage Shelf, Sofa Tables Buffet Sideboard for Kitchen, Hallway, Dining, Living Room, Ash Gray","B0BKSST8JG","https://www.amazon.com/dp/B0BKSST8JG?psc=1","https://m.media-amazon.com/images/I/81OeFSiUXKL._AC_SX466_.jpg","HOSTACK",119.99,517,"62,034.83","51,619","CN","n/a",1,4.5,100,7,21,"Seleadc","Home & Kitchen","n/a","MFN","n/a","n/a","10/28/2022"
"($) Tribesigns Console Sofa Table, 70.9 inch Extra Long Console Table Behind Couch with Storage Shelves, 3-Tier Industrial Narrow Entryway Hallway Accent Table for Living Room, Rustic Brown","B0BDRW2PXR","https://www.amazon.com/dp/B0BDRW2PXR?psc=1","https://m.media-amazon.com/images/I/818uRd1gZ3L._AC_SY450_.jpg","Tribesigns",179.99,160,"28,798.40","265,355","CN","n/a",1,4.7,57,7,4,"Tribesigns-Way to Origin","Home & Kitchen","n/a","MFN","n/a","n/a","9/9/2022"
"HOMERECOMMEND Console Sofa Tables End Table Computer Desk Coffee Snack Console Tables for Living Room Or Corridor Hallway Rustic Brown Color Wood","B088MDXBQR","https://www.amazon.com/dp/B088MDXBQR?psc=1","https://m.media-amazon.com/images/I/71s-09mtZDL._AC_SY450_.jpg","HOMERECOMMEND",51.99,397,"20,640.03","86,399","CN",24.40,4,4.4,"3,430",6,16,"HOMERECOMMEND Manufacturer Direct","Home & Kitchen","Small Oversize","FBA","13.1x3.0x42.8",14.80,"5/14/2020"
"ChooChoo Narrow Console Table, Chic Accent Sofa Table, Entryway Table, White","B07SYY7FVN","https://www.amazon.com/dp/B07SYY7FVN?psc=1","https://m.media-amazon.com/images/I/71zjPQttTML._AC_SY450_.jpg","ChooChoo",79.99,"1,017","81,349.83","33,628","CN",32.65,3,4.5,"3,046",5,44,"ChooChoo Furniture","Home & Kitchen","Small Oversize","FBA","15.6x5.0x44.0",26.40,"9/10/2019"
"ELYKEN 5.9"" Narrow Console Sofa Table with Power Outlets, 5.9"" Dx63 Wx31.5 H Long Skinny Behind Couch Table with “X” Cross Metal Frame and Charge Station with 6.5’ Extension Cord, Black","B0BX8LCFC6","https://www.amazon.com/dp/B0BX8LCFC6?psc=1","https://m.media-amazon.com/images/I/615WefnL5qL._AC_SX466_.jpg","ELYKEN",63.99,300,"19,197.00","62,507","CN",26.89,1,4.5,67,7,9,"Elyken","Home & Kitchen","Small Oversize","FBA","8.0x5.0x35.6",18.40,"11/23/2022"
"Yoobure Sofa Table 70.9 Inch Narrow Console Table with 2 Outlet and 2 USB Ports Extra Long Entryway Table with X-Shaped Design Entry Behind Couch Table for Hallway Living Room Foyer","B0BTSJJYTZ","https://www.amazon.com/dp/B0BTSJJYTZ?psc=1","https://m.media-amazon.com/images/I/61YSnZ90-HL._AC_SY450_.jpg","Yoobure",69.99,195,"13,648.05","130,921","CN",22.48,1,4.4,57,7,34,"Fancee Home","Home & Kitchen","Small Oversize","FBA","14.2x6.2x38.4",28.40,"4/3/2023"
"($) OKD Console Table w/Sliding Barn Doors, Farmhouse 46 Inch Entryway Table w/Adjustable Shelf, Rustic Sofa Table w/2 Storage Cabinets for Entry Way, Hallway, Living Room, Light Rustic Oak","B098FBLPXK","https://www.amazon.com/dp/B098FBLPXK?psc=1","https://m.media-amazon.com/images/I/81C5uHqkAsL._AC_SX466_.jpg","OKD",193.99,99,"19,205.01","237,642","CN","n/a",1,4.5,21,7,1,"OKD-us","Home & Kitchen","n/a","MFN","n/a","n/a","7/1/2021"
"($) Lifewit 39.4” Console Entryway Table with 2 Power Outlets and 2 USB Ports,Industrial Narrow Sofa Table for Hallway, Living Room,Bedroom,Kitchen, Metal Frame, Rustic Brown, Easy Assembly","B0BG4BG9VW","https://www.amazon.com/dp/B0BG4BG9VW?psc=1","https://m.media-amazon.com/images/I/61KfSFlCghL._AC_SX466_.jpg","Lifewit",62.99,105,"6,613.95","312,074","US",25.48,1,4.8,73,9,8,"Lifewit Home","Home & Kitchen","Small Oversize","FBA","14.1x3.3x41.5",15.80,"12/8/2022"
"($) Giantex Console Table Easy Assembly Entryway Table W/Storage Drawer and Bottom Shelf, Mufti-Functional Home Furniture for Hallway, Living Room, Bedroom, Office 47 Inch Accent Hall Table (Gray Wash)","B08C58V7JZ","https://www.amazon.com/dp/B08C58V7JZ?psc=1","https://m.media-amazon.com/images/I/61YD0ui55lL._AC_SX466_.jpg","Giantex",129.99,83,"10,789.17","327,850","US","n/a",1,4.5,818,9,10,"Giantex","Home & Kitchen","n/a","MFN","n/a","n/a","6/29/2020"
"($) Tribesigns Long Console Table, 70.89 inches Sofa Table, 3 Tier Entryway Table, Industrial Hallway Table, Large Storage Accent Table for Living Room Garage, Rustic Behind Couch Table","B09TVJCF2X","https://www.amazon.com/dp/B09TVJCF2X?psc=1","https://m.media-amazon.com/images/I/81LDisN0IuL._AC_SX466_.jpg","Tribesigns",169.99,145,"24,648.55","144,291","CN","n/a",1,4.4,49,7,3,"HOME HQ","Home & Kitchen","Medium Oversize","MFN","13.8x75.6x5.5",73.00,"3/4/2022"
"Sauder North Avenue Sofa Table, Charter Oak finish, L: 41.50"" x W: 11.50"" x H: 28.03""","B01GS8J9V8","https://www.amazon.com/dp/B01GS8J9V8?psc=1","https://m.media-amazon.com/images/I/61fIBFUax1L._AC_SX466_.jpg","Sauder",57.99,324,"18,788.76","93,350","AMZ",24.73,7,4.7,"7,159",8,17,"Amazon","Home & Kitchen","Small Oversize","AMZ","13.9x3.6x44.6",15.25,"n/a"
"Winsome Wood Rochester Occasional Table, Antique Walnut","B0046EC1CG","https://www.amazon.com/dp/B0046EC1CG?psc=1","https://m.media-amazon.com/images/I/61pJS0GAKaL._AC_SX679_.jpg","Winsome",88.93,133,"11,827.69","212,073","AMZ",39.86,29,4.7,"3,105",8,2,"Amazon","Home & Kitchen","Small Oversize","FBA","19.8x6.0x47.5",34.51,"4/15/2004"
"SUPERJARE Console Table with Outlet, 63 Inch Sofa Table with Charging Station, Narrow Entryway Table, Skinny Hallway Table, Behind Couch Table Skinny for Entryway, Living Room, Plants - Vintage Brown","B0B5TKL62Q","https://www.amazon.com/dp/B0B5TKL62Q?psc=1","https://m.media-amazon.com/images/I/61uF-2PXdAL._AC_SX425_.jpg","SUPERJARE",69.99,"1,712","119,822.88","14,457","US",26.95,3,4.5,237,8,-6,"Superjare Direct","Home & Kitchen","Small Oversize","FBA","10.8x4.5x35.3",16.75,"7/5/2022"
"ChooChoo Console Table with Drawers, Narrow Wood Accent Sofa Table Entryway Table with Storage Shelf for Entryway, Front Hall, Hallway, Living Room, Black","B09SPQDQ1X","https://www.amazon.com/dp/B09SPQDQ1X?psc=1","https://m.media-amazon.com/images/I/81SWssP+fOL._AC_SX425_.jpg","ChooChoo",99.99,733,"73,292.67","51,383","CN",41.53,3,4.4,"1,923",6,34,"ChooChoo Furniture","Home & Kitchen","Small Oversize","FBA","14.5x7.5x43.5",40.91,"2/17/2022"
"($) Tribesigns 70.8 Inch Narrow Console Table, Long Sofa Table Entry Table with 3 Tier Storage Shelves for Entryway Hallway Living Room (Brown)","B099MW55QS","https://www.amazon.com/dp/B099MW55QS?psc=1","https://m.media-amazon.com/images/I/818Aujwk9IS._AC_SY450_.jpg","Tribesigns",189.99,258,"49,017.42","153,144","CN","n/a",1,4.6,195,7,14,"hongyanzhiji","Home & Kitchen","n/a","MFN","n/a","n/a","7/16/2021"
"Furologee Console Table, Dresser TV Stand for Bedroom, Tall Entertainment Center with Shelves, Sofa Table with 5 Fabric Drawers Closet Storage Organizer for Living Room/Entryway/Hallway, Rustic Brown","B097DK6835","https://www.amazon.com/dp/B097DK6835?psc=1","https://m.media-amazon.com/images/I/81GgSN7aL0L._AC_SX466_.jpg","Furologee",89.99,"1,178","106,008.22","27,393","CN",35.83,1,4.5,"1,125",9,54,"Engriy Store","Home & Kitchen","Small Oversize","FBA","12.8x5.0x41.5",30.40,"6/17/2021"
"Narrow Console Table with Power Strips, Sofa Table with Storage Shelves for Living Room, 2-Tier Foyer Table for Entryway, Hallway, Behind Couch, Kitchen Counter, 39'', Grey Oak & Black","B0BLMH9QLY","https://www.amazon.com/dp/B0BLMH9QLY?psc=1","https://m.media-amazon.com/images/I/71+A8e2ptyL._AC_SX466_.jpg","armocity",66.99,535,"35,839.65","60,713","CN",22.66,2,4.5,76,9,17,"Armocity","Home & Kitchen","Large Standard-Size","FBA","13.7x6.7x16.4",19.95,"12/23/2022"
"SUPERJARE 70 Inch Console Table with 2 Outlet and 2 USB Ports, Extra Long Entryway Table with Metal Frame and X-Shaped Design, Narrow Sofa Table for Living Room and Hallway - Vintage Brown","B09JYTCH12","https://www.amazon.com/dp/B09JYTCH12?psc=1","https://m.media-amazon.com/images/I/61NXe5uArML._AC_SX679_.jpg","SUPERJARE",84.99,"1,547","131,479.53","18,130","US",36.07,5,4.7,"1,068",9,69,"Superjare Direct","Home & Kitchen","Small Oversize","FBA","14.0x5.5x38.5",30.36,"10/21/2021"
"ALLOSWELL 63"" Console Table, Narrow Sofa Table, Entryway Table, Industrial Sofa Table, Side Table, for Hallway, Living Room, Bedroom, Sturdy and Stable, Easy to Assemble, Rustic Brown CTHR16001","B09G2QJ12V","https://www.amazon.com/dp/B09G2QJ12V?psc=1","https://m.media-amazon.com/images/I/6196jBU9opL._AC_SX569_.jpg","ALLOSWELL",49.99,378,"18,896.22","90,339","CN",24.79,2,4.6,622,10,39,"ALLOSWELL","Home & Kitchen","Small Oversize","FBA","10.0x4.4x35.5",19.00,"12/2/2021"
"Yaheetech Industrial Console Table with Drawer, Sofa Table Narrow Console Table for Entryway/Living Room, Entry Hallway Table with 2 Tier Open Storage, Rustic Brown","B08TWYTT97","https://www.amazon.com/dp/B08TWYTT97?psc=1","https://m.media-amazon.com/images/I/81R4E09BALL._AC_SY355_.jpg","Yaheetech",87.99,"1,004","88,341.96","34,244","US",42.25,1,4.6,"2,541",9,70,"Yaheetech","Home & Kitchen","Small Oversize","MFN","14.8x5.9x43.7",46.22,"1/26/2021"
"Masupu 70.9 Inch Console Table with Power Outlet,Modern Narrow Long Sofa Table Behind Couch,Skinny Entry Table with Gold Metal Frame for Entryway,Living Room, Hallway,Rustic Brown","B0BP7MTXHF","https://www.amazon.com/dp/B0BP7MTXHF?psc=1","https://m.media-amazon.com/images/I/71VLzg3r8OL._AC_SY450_.jpg","Masupu",79.99,144,"11,518.56","194,908","CN",29.71,1,4.5,15,9,4,"Masupu","Home & Kitchen","Small Oversize","FBA","9.9x4.3x38.7",19.35,"12/6/2022"
"BON AUGURE Rustic Sofa Table Behind Couch, Industrial Console Tables for Entryway, 3 Tier Wood Shelves Entry Table with Storage for Foyer, Hallway, Front Door (47 Inch, Dark Grey Oak)","B0BBQQLNX2","https://www.amazon.com/dp/B0BBQQLNX2?psc=1","https://m.media-amazon.com/images/I/71aFWNjSYOL._AC_SX679_.jpg","BON AUGURE",149.98,434,"65,091.32","69,475","CN",51.55,1,4.8,"1,348",7,22,"BON AUGURE","Home & Kitchen","Small Oversize","FBA","15.5x6.0x51.0",45.86,"2/27/2023"
"15x9.8 Inch Couch Arm Table - Strong Rubber Wood Foldable Sofa Tray Table Clip on Side Table for Wide Couch Arm with 360° Rotating Phone Holder, Armrest Table for Eat/Drink/Snack/Remote Control","B0BRX96BV3","https://www.amazon.com/dp/B0BRX96BV3?psc=1","https://m.media-amazon.com/images/I/71iousw0e+L._AC_SX466_.jpg","BELO VALE",34.99,64,"2,239.36","71,741","CN",12.90,1,4.7,57,6,2,"BELO VALE","Home & Kitchen","Large Standard-Size","FBA","10.5x3.5x16.1",3.97,"1/9/2023"
"ChooChoo Farmhouse Console Table, Rustic Vintage Narrow Sofa Table for Entryway, Living Room, Hallway, 40 White","B08NDK254L","https://www.amazon.com/dp/B08NDK254L?psc=1","https://m.media-amazon.com/images/I/91NRYswYhKS._AC_SX425_.jpg","ChooChoo",109.99,490,"53,895.10","69,024","CN",37.57,1,4.7,268,7,17,"ChooChoo Furniture","Home & Kitchen","Small Oversize","FBA","14.6x6.1x43.0",27.30,"11/13/2020"
"MAHANCRIS Sofa Table with Power Outlet, 43.7"" Console Table with USB Ports, Behind Couch Table, Entryway Table for Living Room, Entryway, Foyer, Metal Frame, Adjustable Feet, Rustic Brown CTHR11E01Z1","B0BTSM2KW9","https://www.amazon.com/dp/B0BTSM2KW9?psc=1","https://m.media-amazon.com/images/I/71zLifWVWUL._AC_SY450_.jpg","MAHANCRIS",49.99,204,"10,197.96","97,238","CN",18.98,1,4.6,3,9,0,"ALLOSWELL","Home & Kitchen","Large Standard-Size","FBA","13.2x6.0x17.2",16.45,"4/27/2023"
"Rolanstar Console Table, Narrow Sofa Table with 2 Mesh Shelves, 47.2” Long Rustic Entryway Table with Retro Metal Frame, Entrance Table for Entryway, Hallway, Living Room, Bedroom","B08ZSH32R8","https://www.amazon.com/dp/B08ZSH32R8?psc=1","https://m.media-amazon.com/images/I/81ygZOUcfTL._AC_SX679_.jpg","Rolanstar",54.99,246,"13,527.54","79,504","CN",27.64,1,4.8,"2,481",9,28,"RolanstarDirect","Home & Kitchen","Small Oversize","FBA","11.7x4.0x50.3",23.85,"3/23/2021"
"MAHANCRIS Console Table, 2-Tier Entrance Table, Behind Sofa Table, Industrial Style, Sturdy and Stable, for Living Room, Entryway, Foyer, Corridor, Office, Rustic Brown and Black CTHR27601","B0BSLJ3BSM","https://www.amazon.com/dp/B0BSLJ3BSM?psc=1","https://m.media-amazon.com/images/I/61bkGpjg4-L._AC_SY355_.jpg","MAHANCRIS",39.99,"n/a","n/a","892,349","CN",16.85,1,"n/a",0,"n/a",0,"ALLOSWELL","Home & Kitchen","Large Standard-Size","n/a","11.4x17.1x6.1",14.30,"5/29/2023"
"Convenience Concepts Tucson Console Table with Shelf, Black","B01HQ2YUEQ","https://www.amazon.com/dp/B01HQ2YUEQ?psc=1","https://m.media-amazon.com/images/I/71PgzUvJoOL._AC_SX425_.jpg","Convenience Concepts",86.08,280,"24,102.40","176,553","AMZ",32.29,18,4.6,"3,620",9,6,"Amazon","Home & Kitchen","Small Oversize","FBA","11.5x5.0x48.5",23.10,"6/29/2016"
"MAHANCRIS Console Table, 40.2” Modern Sofa Table, Tempered Glass Hallway Table, Slim Couch Table, Narrow Sofa Table with Metal Frame, Easy to Install, for Entryway, Living Room, Black CTH101B01","B0BQ6HY9RT","https://www.amazon.com/dp/B0BQ6HY9RT?psc=1","https://m.media-amazon.com/images/I/51aIkU9UCgL._AC_SX425_.jpg","MAHANCRIS",45.99,"n/a","n/a","81,304","CN",17.59,1,5.0,1,8,0,"ALLOSWELL","Home & Kitchen","Large Standard-Size","FBA","10.2x5.3x17.4",13.67,"5/3/2023"
"ALLOSWELL Console Table, 70.9"" Narrow Long Sofa Table, Entryway Table, Industrial Sofa Table, Side Table, for Hallway, Living Room, Sturdy and Stable, Easy to Assemble, Rustic Brown CTHR18001","B09RF1RTV7","https://www.amazon.com/dp/B09RF1RTV7?psc=1","https://m.media-amazon.com/images/I/61QCgmmNLgL._AC_SY355_.jpg","ALLOSWELL",59.99,511,"30,654.89","70,479","CN",28.12,1,4.6,751,9,48,"ALLOSWELL","Home & Kitchen","Small Oversize","FBA","10.2x4.5x40.2",20.65,"1/28/2022"
"HOOBRO 29.5 Inches Narrow Console Table, Small Sofa Table, Entryway Table with Shelves, Side Table, Display Table, for Hallway, Bedroom, Foyer, Living Room, Rustic Brown and Black BF22XG01","B09NKWYWYP","https://www.amazon.com/dp/B09NKWYWYP?psc=1","https://m.media-amazon.com/images/I/61lO-UKRnzL._AC_SX466_.jpg","HOOBRO",43.99,361,"15,880.39","70,585","CN",17.29,3,4.3,117,8,15,"Hoobro","Home & Kitchen","Large Standard-Size","FBA","10.5x5.9x17.4",13.71,"12/13/2021"
"IDEALHOUSE Console Table with Power Outlets & USB Ports, Narrow Sofa Table with Charging Station, 39.3"" Industrial Entryway Table, Behind Couch Table for Living Room, Hallway, Foyer, Bedroom-Grey","B0BL7FDCJ9","https://www.amazon.com/dp/B0BL7FDCJ9?psc=1","https://m.media-amazon.com/images/I/61H7yoLraWL._AC_SX679_.jpg","IDEALHOUSE",49.90,352,"17,564.80","139,513","AMZ",22.26,6,4.7,91,7,22,"Amazon","Home & Kitchen","Small Oversize","AMZ","11.0x42.0x3.5",13.00,"11/2/2022"
"HOOBRO Console Table, 55.1"" Narrow Entryway Table, Extra Long Sofa Table Behind Couch, 1.2” Thick Board, Skinny Hallway Table, Living Room, Corridor, Vintage Brown and Black BF140XG01G1","B09VB6MG61","https://www.amazon.com/dp/B09VB6MG61?psc=1","https://m.media-amazon.com/images/I/61U9iPcxJJL._AC_SX425_.jpg","HOOBRO",49.99,273,"13,647.27","92,473","CN",26.89,2,4.5,252,9,19,"Hoobro","Home & Kitchen","Small Oversize","FBA","11.0x6.5x32.6",23.35,"6/1/2022"
"Winsome Nolan Occasional Table, Cappuccino","B007PBJ4G8","https://www.amazon.com/dp/B007PBJ4G8?psc=1","https://m.media-amazon.com/images/I/61oodZLwcIL._AC_SX466_.jpg","Winsome",104.22,102,"10,630.44","235,581","AMZ",44.68,29,4.7,"1,373",9,3,"Amazon","Home & Kitchen","Small Oversize","FBA","19.8x7.5x44.0",42.51,"3/28/2012"
"Clip On Tray Sofa Table for Wide Couches. Couch Arm Tray Table, Portable Table, TV Table and Side Tables for Small Spaces. Stable Sofa Arm Table for Eating and Drink Table (Brown)","B0BS1SXM3B","https://www.amazon.com/dp/B0BS1SXM3B?psc=1","https://m.media-amazon.com/images/I/81NmRbO0hJL._AC_SX425_.jpg","Shamrock Home",29.99,749,"22,462.51","33,537","CA",11.88,1,4.6,"1,423",5,20,"Shamrock Commerce","Home & Kitchen","Large Standard-Size","FBA","12.0x2.2x14.7",2.92,"1/10/2023"
"Karcog Narrow Console Table with Recessed Power Strip, 47 Inch Sofa Entry Table with 2 AC Outlets & 2 USB Ports, Industrial Farmhouse Style Accent Hallway Table for Living Room, Grey Oak","B09PD7B59J","https://www.amazon.com/dp/B09PD7B59J?psc=1","https://m.media-amazon.com/images/I/71kaogLXEZL._AC_SY450_.jpg","Karcog",79.99,425,"33,995.75","72,689","CN",30.55,4,4.7,697,9,15,"Karcog","Home & Kitchen","Small Oversize","FBA","11.8x5.0x50.5",20.05,"12/29/2021"
"IDEALHOUSE Console Table with 2 Drawers, Farmhouse Entryway Table with Storage Shelf, Accent Wood Sofa Table for Living Room, Hallway, Foyer-Grey","B0BGY2Q3DZ","https://www.amazon.com/dp/B0BGY2Q3DZ?psc=1","https://m.media-amazon.com/images/I/71TZR9f+QsL._AC_SX425_.jpg","IDEALHOUSE",89.99,213,"19,167.87","110,380","CN",42.97,1,4.4,72,7,12,"Yartaka shop","Home & Kitchen","Small Oversize","MFN","6.0x45.0x13.0",48.00,"9/30/2022"
"SUCRSIXBRO Console Table with Charging Station, 70.9’’ Narrow Sofa Table, Entryway Table with Outlets and USB Ports,Easy Assembly,Living Room, Bedroom,Rustic Brown","B0BKXTZNRB","https://www.amazon.com/dp/B0BKXTZNRB?psc=1","https://m.media-amazon.com/images/I/8140r+cUI1L._AC_SY450_.jpg","SUCRSIXBRO",59.99,48,"2,879.52","109,531","CN",25.87,1,4.3,17,9,0,"SUNRISEEE","Home & Kitchen","Small Oversize","FBA","7.9x5.4x39.0",17.90,"10/30/2022"
"AZL1 Life Concept Console Table, Sofa Table for Living Room，Hallway，Entryway, Entrance Hall, Corridor - Wood Look Metal Frame","B08GCLLRKM","https://www.amazon.com/dp/B08GCLLRKM?psc=1","https://m.media-amazon.com/images/I/51a1jv4GC7S._AC_SX679_.jpg","AZL1 Life Concept",37.56,"n/a","n/a","282,403","AMZ",24.33,5,4.5,334,7,1,"Amazon","Home & Kitchen","Small Oversize","AMZ","16.0x3.8x46.3",20.00,"4/8/2021"
