"Product Details","ASIN","URL","Image URL","Brand","Price $","Sales","Revenue","BSR","Seller Country/Region","Fees $","Active Sellers #","Ratings","Review Count","Images","Review velocity","Buy Box","Category","Size Tier","Fulfillment","Dimensions","Weight","Creation Date"
"KATHY&BOB 360°Free Rotating Sofa Side Table Mobile Couch Desk Table with 2-Tier Storage Shelves, Laptop Table for Couch with Sturdy Metal Frame, Couch Side Table for Home, Rustic Brown","B09VRRR2J5","https://www.amazon.com/dp/B09VRRR2J5?psc=1","https://m.media-amazon.com/images/I/81pUMGr2+NL._AC_SY450_.jpg","KATHY&BOB",109.95,55,"6,047.25","251,067","CN","n/a",1,4.5,35,7,5,"KBhome","Home & Kitchen","n/a","MFN","14.5x35.3x8.1","n/a","3/17/2022"
"Sofa Table, 3 Tiers TV Console TV Stand Long Sofa Table with Storage Shelves for Hallyway, Living Room, 55 Inch","B0B55XQHFZ","https://www.amazon.com/dp/B0B55XQHFZ?psc=1","https://m.media-amazon.com/images/I/71Eq+-C6wrL._AC_SY450_.jpg","Tribesigns",149.99,232,"34,797.68","110,198","CN",62.13,1,4.7,800,7,11,"USDUSHU","Home & Kitchen","Medium Oversize","MFN","15.5x7.0x61.0",50.01,"11/11/2020"
"IDEALHOUSE Sofa Tables Narrow Long, Extra Long Console Table with Outlets, 73.2"" Behind Couch Table, Grey Farmhouse Entryway Table for Living Room, Hallway, Foyer","B0BRFW8DQ6","https://www.amazon.com/dp/B0BRFW8DQ6?psc=1","https://m.media-amazon.com/images/I/61zenxbCCfL._AC_SY450_.jpg","IDEALHOUSE",99.99,81,"8,099.19","298,090","AMZ",37.75,2,4.3,24,7,7,"Amazon","Home & Kitchen","Small Oversize","AMZ","12.0x40.0x7.0",32.00,"12/31/2022"
"LAATOOREE Console Table, 41.7"" Industrial Entryway Table with Shelf, Narrow Sofa Table for Hallway, Entrance Hall, Foyer, Corridor, Living Room - Wood Look Metal Frame - Black & Rustic Brown","B0B8RNN4K5","https://www.amazon.com/dp/B0B8RNN4K5?psc=1","https://m.media-amazon.com/images/I/71daWbYP1rL._AC_SX679_.jpg","LAATOOREE",49.99,588,"29,394.12","44,062","CN",18.51,1,4.4,259,8,29,"linlai","Home & Kitchen","Large Standard-Size","FBA","12.1x6.4x17.4",14.68,"8/5/2022"
"VANOMi 70.8 Inch Extra Long Console Table for Entryway, Narrow Hallway Table, Wood Sofa Table with 3 Tier Storage Shelves for Living Room","B0B578KXW7","https://www.amazon.com/dp/B0B578KXW7?psc=1","https://m.media-amazon.com/images/I/811T6Efg3IL._AC_SX679_.jpg","VANOMi",172.99,143,"24,737.57","154,090","n/a","n/a",1,4.5,17,8,2,"n/a","Home & Kitchen","n/a","MFN","n/a","n/a","6/27/2022"